P39334,P39334,Uncharacterized HTH-type transcriptional regulator YjgJ,yjgJ,>sp|P39334|YJGJ_ECOLI Uncharacterized HTH-type transcriptional regulator yjgJ OS=Escherichia coli (strain K12) GN=yjgJ PE=4 SV=2,ECOLI,25.13360658657586,25.141971934369927,25.212209357812238,24.961471559307764,24.995784878194023,25.39545969372923,25.21803905817348,25.220984756566978
P39337,P39337,Uncharacterized N-acetyltransferase YjgM,yjgM,>sp|P39337|YJGM_ECOLI Uncharacterized N-acetyltransferase YjgM OS=Escherichia coli (strain K12) GN=yjgM PE=3 SV=2,ECOLI,26.892189107898236,27.013206675359523,27.094396333765136,26.792248366656555,27.150034311869675,26.779740110066133,26.963276444806258,26.711897264300656
P39342,P39342,Uncharacterized protein yjgR,yjgR,>sp|P39342|YJGR_ECOLI Uncharacterized protein yjgR OS=Escherichia coli (strain K12) GN=yjgR PE=4 SV=1,ECOLI,30.040008452521793,29.939826370778498,30.06408738476086,30.232385821546735,29.94660546633844,29.97932823549487,29.805599952058955,30.1018315659789
P39353,P39353,Uncharacterized oxidoreductase YjhC,yjhC,>sp|P39353|YJHC_ECOLI Uncharacterized oxidoreductase yjhC OS=Escherichia coli (strain K12) GN=yjhC PE=3 SV=2,ECOLI,29.037539001205367,29.19118597407183,29.136949239174267,29.4562990124025,29.549657497335687,29.058950336618214,29.388504001796033,29.357762834350552
P39356,P39356,Uncharacterized transcriptional regulator YjhU,yjhU,>sp|P39356|YJHU_ECOLI Uncharacterized transcriptional regulator yjhU OS=Escherichia coli (strain K12) GN=yjhU PE=3 SV=2,ECOLI,27.67759797653807,27.24222618096583,27.434281456943484,27.12867205344264,27.16940497041145,27.224879641134393,27.287056453391873,27.459224319175814
P39358,P39358,Uncharacterized protein YjhG,yjhG,>sp|P39358|YJHG_ECOLI Uncharacterized protein YjhG OS=Escherichia coli (strain K12) GN=yjhG PE=1 SV=2,ECOLI,25.719685562354147,26.01939289983412,25.903003535765627,25.871430648580066,25.890851015450863,26.206242729849293,25.18798105496386,25.86743478577482
P39366,P39366,Putative aminopeptidase sgcX,sgcX,>sp|P39366|SGCX_ECOLI Putative aminopeptidase sgcX OS=Escherichia coli (strain K12) GN=sgcX PE=3 SV=3,ECOLI,NA,24.293168202752184,24.736714346346748,25.003653023649985,24.577776546678678,24.108330436945867,25.10690103254388,24.77954914358818
P39371,P39371,N-acetylneuraminate epimerase,nanM,>sp|P39371|NANM_ECOLI N-acetylneuraminate epimerase OS=Escherichia coli (strain K12) GN=nanM PE=1 SV=2,ECOLI,29.828688099705754,29.78450181649345,29.40549333392934,29.397066150778333,29.45445546641561,29.46596015936882,29.809894977786247,29.749325205839018
P39377,P39377,Isoaspartyl dipeptidase,iadA,>sp|P39377|IADA_ECOLI Isoaspartyl dipeptidase OS=Escherichia coli (strain K12) GN=iadA PE=1 SV=1,ECOLI,27.672141506172988,28.457256264172212,28.296281810063288,28.27172288221637,28.28320377424977,28.581062200248496,27.81725626114198,27.999111053977373
P39401,P39401,Phosphoglycerol transferase I,mdoB,>sp|P39401|OPGB_ECOLI Phosphoglycerol transferase I OS=Escherichia coli (strain K12) GN=mdoB PE=3 SV=2,ECOLI,26.34773319727323,27.19643450745286,27.11581758909064,27.073686477477377,27.13242614042686,26.947537703767686,27.24194091503663,26.961561977084564
P39406,P39406,Ribosomal RNA small subunit methyltransferase C,rsmC,>sp|P39406|RSMC_ECOLI Ribosomal RNA small subunit methyltransferase C OS=Escherichia coli (strain K12) GN=rsmC PE=1 SV=3,ECOLI,27.81583037316427,28.58541562428305,28.20160229238174,28.616586128989777,28.74406882871406,28.281305955354696,28.525201043903724,28.554719418530965
P39407,P39407,Uncharacterized protein yjjU,yjjU,>sp|P39407|YJJU_ECOLI Uncharacterized protein yjjU OS=Escherichia coli (strain K12) GN=yjjU PE=3 SV=1,ECOLI,22.410857817270365,23.49065942243943,22.990535164059434,23.20879663517746,23.77275424397447,22.93699072569807,23.642329070933133,23.315808018189117
P39408,P39408,Uncharacterized deoxyribonuclease YjjV,yjjV,>sp|P39408|YJJV_ECOLI Uncharacterized deoxyribonuclease YjjV OS=Escherichia coli (strain K12) GN=yjjV PE=1 SV=2,ECOLI,NA,26.432233406685103,26.342624298868117,26.269715452296776,26.39243721345227,25.966800314590607,26.341511333860982,26.13893480936958
P39411,P39411,Non-canonical purine NTP phosphatase,yjjX,>sp|P39411|NCPP_ECOLI Non-canonical purine NTP phosphatase OS=Escherichia coli (strain K12) GN=yjjX PE=1 SV=2,ECOLI,26.112511093870058,25.721199656404334,26.656120158376883,25.654429071198145,25.785479880647387,26.41465613500491,25.89405845628716,25.970193169385478
P39451,P39451,"Alcohol dehydrogenase, propanol-preferring",adhP,">sp|P39451|ADHP_ECOLI Alcohol dehydrogenase, propanol-preferring OS=Escherichia coli (strain K12) GN=adhP PE=1 SV=1",ECOLI,27.745402978938465,28.14446544503402,27.899380996727004,28.064915332404745,28.315084098026492,28.396976800545456,28.308066317096543,28.226463805254177
P39829,P39829,D-galactarate dehydratase,garD,>sp|P39829|GARD_ECOLI D-galactarate dehydratase OS=Escherichia coli (strain K12) GN=garD PE=1 SV=2,ECOLI,24.840267148566273,24.662228013030273,24.676498142295806,24.478563026345387,24.70395658269683,24.67979350136348,24.728227570176472,24.676313145187173
P39830,P39830,Inner membrane protein ybaL,ybaL,>sp|P39830|YBAL_ECOLI Inner membrane protein ybaL OS=Escherichia coli (strain K12) GN=ybaL PE=1 SV=2,ECOLI,26.85604934195975,27.54457751620229,27.35960355961861,27.75235912474283,27.683484694852197,27.809076518308448,27.594401402101635,27.848411698891297
P39831,P39831,NADP-dependent 3-hydroxy acid dehydrogenase YdfG,ydfG,>sp|P39831|YDFG_ECOLI NADP-dependent 3-hydroxy acid dehydrogenase YdfG OS=Escherichia coli (strain K12) GN=ydfG PE=1 SV=2,ECOLI,30.26040434013123,31.01887114519504,30.99246408201092,31.20200486225865,31.029259531693928,30.811953157019904,31.427160524068313,31.19599236777327
P39835,P39835,High-affinity gluconate transporter,gntT,>sp|P39835|GNTT_ECOLI High-affinity gluconate transporter OS=Escherichia coli (strain K12) GN=gntT PE=1 SV=3,ECOLI,23.556163578984766,23.459468913286653,23.323251384648795,22.847243729626374,22.877996881800186,23.692283521272735,23.017182649739937,22.838412862667177
P39836,P39836,Uncharacterized protein yfeH,yfeH,>sp|P39836|YFEH_ECOLI Uncharacterized protein yfeH OS=Escherichia coli (strain K12) GN=yfeH PE=4 SV=2,ECOLI,24.207624619588742,24.032160387413235,23.884175164165665,23.323638696544254,23.74346579921543,24.2119073202853,NA,23.460756354100216
P39838,P39838,Sensor-like histidine kinase RcsD,rcsD,>sp|P39838|RCSD_ECOLI Sensor-like histidine kinase RcsD OS=Escherichia coli (strain K12) GN=rcsD PE=1 SV=3,ECOLI,28.87527645481641,28.955105215949192,28.87913905843347,28.87887738581133,28.842652351493566,28.85205153600357,28.857693853049486,29.071786319125394
P40120,P40120,Glucans biosynthesis protein D,mdoD,>sp|P40120|OPGD_ECOLI Glucans biosynthesis protein D OS=Escherichia coli (strain K12) GN=mdoD PE=1 SV=3,ECOLI,29.183972666445822,29.38587977018323,29.063887013927964,29.18876240531817,29.29654660873221,28.98087912567092,29.372914867564653,29.195114938628624
P40191,P40191,Pyridoxine kinase,pdxK,>sp|P40191|PDXK_ECOLI Pyridoxine kinase OS=Escherichia coli (strain K12) GN=pdxK PE=1 SV=2,ECOLI,26.88795363196389,27.47067232270796,27.471692566366233,27.716585052923904,27.609556842722622,27.406726424005406,27.456081213331778,27.384304401048674
P40710,P40710,Lipoprotein NlpE,nlpE,>sp|P40710|NLPE_ECOLI Lipoprotein NlpE OS=Escherichia coli (strain K12) GN=nlpE PE=1 SV=1,ECOLI,27.495329041248862,28.132858986378405,27.766127144144004,28.585685131344768,28.382009754396552,28.23280290804786,28.6542013296449,28.41175530199863
P40874,P40874,N-methyl-L-tryptophan oxidase,solA,>sp|P40874|MTOX_ECOLI N-methyl-L-tryptophan oxidase OS=Escherichia coli (strain K12) GN=solA PE=1 SV=1,ECOLI,29.138345649954175,28.98298628736746,28.869254611852234,29.057073738051304,29.1036691857256,28.868783592353275,29.094672630701613,29.0650266481017
P41039,P41039,Uncharacterized protein YbiI,ybiI,>sp|P41039|YBII_ECOLI Uncharacterized protein YbiI OS=Escherichia coli (strain K12) GN=ybiI PE=1 SV=1,ECOLI,26.66738777793585,26.35267448102379,25.485836232927028,24.660407041322816,25.548607137990047,26.25976183585707,25.646842679786136,25.220872912516977
P41052,P41052,Membrane-bound lytic murein transglycosylase B,mltB,>sp|P41052|MLTB_ECOLI Membrane-bound lytic murein transglycosylase B OS=Escherichia coli (strain K12) GN=mltB PE=1 SV=1,ECOLI,27.94465652779237,28.01957764269589,28.22768450324739,27.842334250617473,28.061198852472394,28.227036513644975,28.050258296851663,28.132478283091174
P41159ups,P41159ups,NA,NA,>P41159ups|LEP_HUMAN_UPS Leptin (Chain 22-167) - Homo sapiens (Human),UPS,31.636755059881164,31.87091666125835,31.782323782389877,31.851079901388296,33.565752945214484,33.56317869253937,33.76045409863936,33.6824221641989
P41407,P41407,FMN-dependent NADH-azoreductase,azoR,>sp|P41407|AZOR_ECOLI FMN-dependent NADH-azoreductase OS=Escherichia coli (strain K12) GN=azoR PE=1 SV=3,ECOLI,28.255801799860304,28.636298610369614,28.723315915421576,28.55681759073909,28.4431956280068,28.527556599088925,28.665434081239198,28.226463805254177
P41409,P41409,Pyrimidine-specific ribonucleoside hydrolase RihA,rihA,>sp|P41409|RIHA_ECOLI Pyrimidine-specific ribonucleoside hydrolase rihA OS=Escherichia coli (strain K12) GN=rihA PE=1 SV=2,ECOLI,30.113077662054017,30.607091520934553,30.002953595027066,30.23181307349805,30.54070306538641,30.338688455249656,30.443418490266883,30.35168903529657
P41441,P41441,Putative type II secretion system protein F,gspF,>sp|P41441|GSPF_ECOLI Putative general secretion pathway protein F OS=Escherichia coli (strain K12) GN=gspF PE=1 SV=1,ECOLI,26.559934652941,26.716514925616163,26.771658721392274,26.931152477584874,26.912141234264578,27.501747547157084,26.08203854829942,26.712957972034047
P42588,P42588,Putrescine aminotransferase,patA,>sp|P42588|PAT_ECOLI Putrescine aminotransferase OS=Escherichia coli (strain K12) GN=patA PE=1 SV=2,ECOLI,29.422793088680358,29.575729734052068,29.778802949044927,29.609848702318413,29.73978916038596,29.723527930650263,30.007819201118075,29.925470833839558
P42589,P42589,tRNA-binding protein ygjH,ygjH,>sp|P42589|YGJH_ECOLI tRNA-binding protein ygjH OS=Escherichia coli (strain K12) GN=ygjH PE=1 SV=1,ECOLI,NA,23.978431673594454,23.556926234215435,24.50877315656454,24.28973630462574,NA,24.426719848707034,23.981416298490267
P42593,P42593,"2,4-dienoyl-CoA reductase [NADPH]",fadH,">sp|P42593|FADH_ECOLI 2,4-dienoyl-CoA reductase [NADPH] OS=Escherichia coli (strain K12) GN=fadH PE=1 SV=3",ECOLI,29.871304964945768,30.05510481054994,29.759352865066717,29.900891719894037,29.947181105265134,29.74333286578294,29.94848506173567,29.793441725242296
P42596,P42596,Ribosomal RNA large subunit methyltransferase G,rlmG,>sp|P42596|RLMG_ECOLI Ribosomal RNA large subunit methyltransferase G OS=Escherichia coli (strain K12) GN=rlmG PE=1 SV=2,ECOLI,25.456525596201274,25.660110499650752,NA,25.62393843841039,25.915039514416303,25.915548787575435,25.705703790961646,26.027098256398986
P42599,P42599,Uncharacterized oxidoreductase YgjR,ygjR,>sp|P42599|YGJR_ECOLI Uncharacterized oxidoreductase ygjR OS=Escherichia coli (strain K12) GN=ygjR PE=3 SV=3,ECOLI,29.047854630670187,29.248220284642194,28.804170167906413,28.63392638043293,28.95438591237728,28.9153154481402,29.13205036777497,28.70071249361135
P42616,P42616,Protein yqjC,yqjC,>sp|P42616|YQJC_ECOLI Protein yqjC OS=Escherichia coli (strain K12) GN=yqjC PE=1 SV=3,ECOLI,29.46222060817351,28.996409899144865,28.77181207396966,28.15940356703714,28.45206451609484,28.935492934823188,28.605060031617665,28.68826106856863
P42620,P42620,Uncharacterized protein yqjG,yqjG,>sp|P42620|YQJG_ECOLI Uncharacterized protein yqjG OS=Escherichia coli (strain K12) GN=yqjG PE=3 SV=1,ECOLI,29.652011852451196,30.06422035370243,29.69375589042049,30.15667838314681,29.948619198527044,29.89063131399815,30.1212217393584,30.045055699194485
P42624,P42624,Pirin-like protein YhaK,yhaK,>sp|P42624|YHAK_ECOLI Pirin-like protein YhaK OS=Escherichia coli (strain K12) GN=yhaK PE=1 SV=1,ECOLI,23.41154887350626,23.691715099398603,23.174859879581337,23.58198678590524,23.7797000101115,23.354537883981113,23.527532517745836,24.290310327472085
P42632,P42632,PFL-like enzyme TdcE,tdcE,>sp|P42632|TDCE_ECOLI PFL-like enzyme TdcE OS=Escherichia coli (strain K12) GN=tdcE PE=1 SV=2,ECOLI,26.67496225990233,26.24577918355215,25.837724106406306,24.798747339162357,25.741582194569393,26.162583476302075,NA,24.893725115889
P42641,P42641,GTPase ObgE/CgtA,obgE,>sp|P42641|OBG_ECOLI GTPase ObgE/CgtA OS=Escherichia coli (strain K12) GN=obgE PE=1 SV=1,ECOLI,28.836401699435733,29.038523458464066,28.854705237997617,29.200097084806828,29.31515099321306,28.991526969737517,29.150477995800745,29.166437137806515
P42904,P42904,N-acetylgalactosamine-specific phosphotransferase enzyme IIB component 2,agaV,>sp|P42904|PTPB2_ECOLI N-acetylgalactosamine-specific phosphotransferase enzyme IIB component 2 OS=Escherichia coli (strain K12) GN=agaV PE=4 SV=1,ECOLI,26.4606215917488,26.67586144961548,26.59128276412857,26.856432749136115,27.084671548862563,26.583535668889848,26.865647117032715,26.7375324125952
P43329,P43329,ATP-dependent RNA helicase hrpA,hrpA,>sp|P43329|HRPA_ECOLI ATP-dependent RNA helicase hrpA OS=Escherichia coli (strain K12) GN=hrpA PE=3 SV=3,ECOLI,29.291885158831246,29.640614987893265,29.314439550946208,29.591714970382583,29.706821632553446,29.289409273081567,29.579242648185513,29.831999161229128
P43337,P43337,Uncharacterized Nudix hydrolase NudL,nudL,>sp|P43337|NUDL_ECOLI Uncharacterized Nudix hydrolase NudL OS=Escherichia coli (strain K12) GN=nudL PE=3 SV=1,ECOLI,26.30315147925607,26.91731499886233,26.748780893804746,26.945419463247415,26.714382216077944,26.596372387655226,27.122564519457008,26.875012245020805
P43671,P43671,Paraquat-inducible protein B,pqiB,>sp|P43671|PQIB_ECOLI Paraquat-inducible protein B OS=Escherichia coli (strain K12) GN=pqiB PE=2 SV=2,ECOLI,27.548133534042552,27.508098112017308,27.32231356920172,27.096617481313935,27.470241267186353,27.66993626056318,27.223947117609985,27.184018145633573
P43672,P43672,ABC transporter ATP-binding protein uup,uup,>sp|P43672|UUP_ECOLI ABC transporter ATP-binding protein uup OS=Escherichia coli (strain K12) GN=uup PE=3 SV=2,ECOLI,29.16033341126654,29.310787323980026,29.04781716245241,29.38685371715264,29.119792580379205,29.262726410657514,29.292142416740568,29.27525579539912
P45395,P45395,Arabinose 5-phosphate isomerase KdsD,kdsD,>sp|P45395|KDSD_ECOLI Arabinose 5-phosphate isomerase KdsD OS=Escherichia coli (strain K12) GN=kdsD PE=1 SV=1,ECOLI,29.58814662604839,29.834233445266282,29.505965659514054,29.641449847474604,29.72968670296965,29.490177914285134,29.70713652212709,29.632420252165012
P45424,P45424,Uncharacterized protein YhcH,yhcH,>sp|P45424|YHCH_ECOLI Uncharacterized protein YhcH OS=Escherichia coli (strain K12) GN=yhcH PE=3 SV=1,ECOLI,28.106824251480344,28.66308388772121,28.65532242817083,28.509476509974533,28.86094432862668,28.471254530206565,28.77005507695522,28.910985706765096
P45425,P45425,N-acetylmannosamine kinase,nanK,>sp|P45425|NANK_ECOLI N-acetylmannosamine kinase OS=Escherichia coli (strain K12) GN=nanK PE=1 SV=2,ECOLI,28.739910914096555,29.122423807194554,28.82101504362479,29.04937132395582,29.241104641713573,28.76383399642816,29.105825053722562,28.955132968723973
P45464,P45464,Penicillin-binding protein activator LpoA,lpoA,>sp|P45464|LPOA_ECOLI Penicillin-binding protein activator LpoA OS=Escherichia coli (strain K12) GN=lpoA PE=1 SV=1,ECOLI,30.4583590862448,30.824749846331805,30.695422184490592,30.875155887811175,30.885674209836367,30.68090878399294,30.74984910953556,30.820204487248578
P45469,P45469,Uncharacterized protein yraR,yraR,>sp|P45469|YRAR_ECOLI Uncharacterized protein yraR OS=Escherichia coli (strain K12) GN=yraR PE=4 SV=2,ECOLI,27.277682331563064,27.096335686228755,27.075437916548513,27.252741845401793,27.276989584444344,27.272134985431034,27.334348120848684,27.236318223086762
P45470,P45470,Protein yhbO,yhbO,>sp|P45470|YHBO_ECOLI Protein yhbO OS=Escherichia coli (strain K12) GN=yhbO PE=1 SV=2,ECOLI,29.528541047538138,29.400640643467128,29.23370903619958,29.33638418790905,29.189151779672116,29.1914756553854,29.511065409592465,29.20461960937283
P45523,P45523,FKBP-type peptidyl-prolyl cis-trans isomerase fkpA,fkpA,>sp|P45523|FKBA_ECOLI FKBP-type peptidyl-prolyl cis-trans isomerase fkpA OS=Escherichia coli (strain K12) GN=fkpA PE=1 SV=1,ECOLI,31.391518568664786,31.788899513892787,31.763322532143135,31.994014634626822,32.07747915400532,31.784795742586756,31.928698783991173,31.99841116681775
P45530,P45530,Protein TusB,tusB,>sp|P45530|TUSB_ECOLI Protein TusB OS=Escherichia coli (strain K12) GN=tusB PE=1 SV=1,ECOLI,NA,22.50632802702036,23.101633317874626,23.000402721433872,23.53479433544798,22.32256511797066,22.9954127344922,23.181506926477525
P45537,P45537,Uncharacterized protein yhfK,yhfK,>sp|P45537|YHFK_ECOLI Uncharacterized protein yhfK OS=Escherichia coli (strain K12) GN=yhfK PE=3 SV=2,ECOLI,23.738695259642295,24.166204839297315,24.1931352493867,23.9282820714275,24.37585716351564,23.907811425452074,24.271276312797518,24.10945380694444
P45544,P45544,HTH-type transcriptional regulator FrlR,frlR,>sp|P45544|FRLR_ECOLI HTH-type transcriptional regulator frlR OS=Escherichia coli (strain K12) GN=frlR PE=1 SV=2,ECOLI,27.457906159051458,27.577649979603457,27.637659830876867,27.952556012242262,27.87789060983661,27.90385828445152,27.794277697363892,27.964682282730465
P45552,P45552,Uncharacterized protein yhfZ,yhfZ,>sp|P45552|YHFZ_ECOLI Uncharacterized protein yhfZ OS=Escherichia coli (strain K12) GN=yhfZ PE=4 SV=3,ECOLI,24.1957718935793,24.158961825788587,24.622393074223556,24.066756049235067,24.64005412318643,24.47983926885247,23.5952738779384,24.43128523560905
P45568,P45568,1-deoxy-D-xylulose 5-phosphate reductoisomerase,dxr,>sp|P45568|DXR_ECOLI 1-deoxy-D-xylulose 5-phosphate reductoisomerase OS=Escherichia coli (strain K12) GN=dxr PE=1 SV=2,ECOLI,26.376156321658183,26.396412338235997,26.88510543016958,26.78863898236561,27.06592404331718,26.862125849150317,27.063080974888194,27.128260526437813
P45577,P45577,ProP effector,proQ,>sp|P45577|PROQ_ECOLI ProP effector OS=Escherichia coli (strain K12) GN=proQ PE=1 SV=2,ECOLI,29.356918667291577,29.8775642584322,29.559408605917394,29.75997449474753,29.86445316387547,29.514953949414128,29.899338093900187,29.699926971416772
P45578,P45578,S-ribosylhomocysteine lyase,luxS,>sp|P45578|LUXS_ECOLI S-ribosylhomocysteine lyase OS=Escherichia coli (strain K12) GN=luxS PE=1 SV=3,ECOLI,32.373736045585474,32.70662719448546,32.345170977336934,32.69532186744195,32.754351025571836,32.455992767434495,32.52433315742226,32.60733572542354
P45748,P45748,tRNA threonylcarbamoyladenosine biosynthesis protein RimN,rimN,>sp|P45748|RIMN_ECOLI tRNA threonylcarbamoyladenosine biosynthesis protein RimN OS=Escherichia coli (strain K12) GN=rimN PE=1 SV=2,ECOLI,27.756551442711146,27.72486987403396,27.90280189967265,27.612719913444845,27.762730373704102,27.646126626220838,27.563958866673474,27.99415698225318
P45771,P45771,Uncharacterized protein yrdD,yrdD,>sp|P45771|YRDD_ECOLI Uncharacterized protein yrdD OS=Escherichia coli (strain K12) GN=yrdD PE=4 SV=2,ECOLI,27.207293003671666,27.566461933333812,27.53926325426866,27.236571427559596,27.60146142176219,27.439786546922196,27.424520388885213,27.558154100578786
P45799,P45799,ADP compounds hydrolase nudE,nudE,>sp|P45799|NUDE_ECOLI ADP compounds hydrolase nudE OS=Escherichia coli (strain K12) GN=nudE PE=1 SV=1,ECOLI,26.475431370129634,26.89888412681599,26.638736469017047,27.037648293405148,26.329700330914704,26.76490830015047,26.954090755968725,26.89886092890164
P45800,P45800,Putative membrane protein igaA homolog,yrfF,>sp|P45800|IGAA_ECOLI Putative membrane protein igaA homolog OS=Escherichia coli (strain K12) GN=yrfF PE=1 SV=1,ECOLI,28.61993438669706,28.5875063009765,28.499998108207876,28.396800478019344,28.533092908361436,28.45775730502463,28.59408464727636,28.36979222154029
P45955,P45955,Uncharacterized protein YbgF,ybgF,>sp|P45955|YBGF_ECOLI Uncharacterized protein YbgF OS=Escherichia coli (strain K12) GN=ybgF PE=1 SV=2,ECOLI,29.003255759238858,29.6172880519368,29.286998494153398,30.179311705841315,29.737328414531206,29.495688866732078,29.753273260329202,29.966212108434114
P46118,P46118,HTH-type transcriptional regulator HexR,hexR,>sp|P46118|HEXR_ECOLI HTH-type transcriptional regulator hexR OS=Escherichia coli (strain K12) GN=hexR PE=3 SV=2,ECOLI,27.03113604851784,27.48160008315196,27.47832323368119,26.728976614922047,27.43693841180697,27.301087536486115,27.385436230614467,27.14495983017069
P46122,P46122,Uncharacterized lipoprotein yajI,yajI,>sp|P46122|YAJI_ECOLI Uncharacterized lipoprotein yajI OS=Escherichia coli (strain K12) GN=yajI PE=1 SV=3,ECOLI,NA,24.35061998667064,24.517026055476393,24.22269183855339,24.639313388340025,24.458562116603407,24.736874300977494,24.87166786747787
P46125,P46125,Inner membrane protein yedI,yedI,>sp|P46125|YEDI_ECOLI Inner membrane protein yedI OS=Escherichia coli (strain K12) GN=yedI PE=1 SV=2,ECOLI,24.36925109133189,25.72384315391975,25.23474183487576,25.28737390156405,26.02683261123704,25.506802895486437,25.458124822642624,25.840704982749504
P46130,P46130,Putative acyl-CoA thioester hydrolase ybhC,ybhC,>sp|P46130|YBHC_ECOLI Putative acyl-CoA thioester hydrolase ybhC OS=Escherichia coli (strain K12) GN=ybhC PE=1 SV=2,ECOLI,30.102194374817188,30.512390296786837,29.978712691649726,30.62970647293938,30.603124323531752,30.064940311892308,30.25569108615004,30.231237492543624
P46837,P46837,Protein yhgF,yhgF,>sp|P46837|YHGF_ECOLI Protein yhgF OS=Escherichia coli (strain K12) GN=yhgF PE=1 SV=3,ECOLI,30.71738188507618,30.7389136768525,30.496272056150275,30.213828149331626,30.541084428074566,30.479207963212176,30.27052328181227,30.432690286276113
P46852,P46852,"Quercetin 2,3-dioxygenase",yhhW,">sp|P46852|YHHW_ECOLI Quercetin 2,3-dioxygenase OS=Escherichia coli (strain K12) GN=yhhW PE=1 SV=1",ECOLI,30.1911384024185,29.915841573290425,29.826355269147324,29.61786672364691,29.921677101401723,29.95267704550576,29.815128825916975,29.808436648624575
P46853,P46853,Uncharacterized oxidoreductase YhhX,yhhX,>sp|P46853|YHHX_ECOLI Uncharacterized oxidoreductase yhhX OS=Escherichia coli (strain K12) GN=yhhX PE=1 SV=1,ECOLI,29.51156904879036,29.778686847568764,29.81642829331085,29.720509688208416,29.88354053419378,29.7974196179804,29.806420485360423,29.87238898725225
P50456,P50456,Protein mlc,mlc,>sp|P50456|MLC_ECOLI Protein mlc OS=Escherichia coli (strain K12) GN=mlc PE=1 SV=2,ECOLI,25.711735139283608,25.520053470942468,26.487256451260585,25.3981242689524,24.96982204503087,26.089830110178195,25.711893392331856,26.65935615518023
P50465,P50465,Endonuclease 8,nei,>sp|P50465|END8_ECOLI Endonuclease 8 OS=Escherichia coli (strain K12) GN=nei PE=1 SV=3,ECOLI,23.90913009416323,23.504391156676782,23.955899738734114,23.75104227796363,24.12928444790173,NA,24.050514844383393,23.740240135259903
P50466,P50466,Aerotaxis receptor,aer,>sp|P50466|AER_ECOLI Aerotaxis receptor OS=Escherichia coli (strain K12) GN=aer PE=1 SV=1,ECOLI,25.99305277809868,25.059772822832816,24.76173597580671,23.931265368937556,24.998275658264244,25.533064110847185,25.327911316108334,25.59381579766237
P51024,P51024,Uncharacterized protein yaiL,yaiL,>sp|P51024|YAIL_ECOLI Uncharacterized protein yaiL OS=Escherichia coli (strain K12) GN=yaiL PE=4 SV=2,ECOLI,27.997537749468925,28.592482378077126,28.223115890482887,28.817508650983395,28.68996501032307,28.09572865317185,28.75313140628415,28.335853896637676
P51025,P51025,S-formylglutathione hydrolase frmB,frmB,>sp|P51025|SFGH1_ECOLI S-formylglutathione hydrolase frmB OS=Escherichia coli (strain K12) GN=frmB PE=1 SV=2,ECOLI,25.441942313555394,25.711169166957887,24.910043103269253,25.19723185356244,25.016908428577388,25.389703035887255,25.24726872238285,25.68660847743253
P51981,P51981,L-Ala-D/L-Glu epimerase,ycjG,>sp|P51981|AEEP_ECOLI L-Ala-D/L-Glu epimerase OS=Escherichia coli (strain K12) GN=ycjG PE=1 SV=2,ECOLI,26.62009009953797,25.698410004549498,25.45349837619201,25.13550799393557,25.668650082182772,25.762556429925727,25.794130626153112,25.72623023202837
P52006,P52006,Nucleoside triphosphatase nudI,nudI,>sp|P52006|NUDI_ECOLI Nucleoside triphosphatase nudI OS=Escherichia coli (strain K12) GN=nudI PE=1 SV=2,ECOLI,23.135211247908224,23.570087170457715,24.227389324505474,24.50713823724395,24.74532046977741,23.509640648474942,24.08161683975539,NA
P52007,P52007,Protein yecM,yecM,>sp|P52007|YECM_ECOLI Protein yecM OS=Escherichia coli (strain K12) GN=yecM PE=1 SV=3,ECOLI,27.088440023860922,26.934937336757464,27.000887951259436,27.091878568926933,27.159106327992905,26.9960279415049,27.25891399364034,27.17143740021834
P52060,P52060,UPF0235 protein yggU,yggU,>sp|P52060|YGGU_ECOLI UPF0235 protein yggU OS=Escherichia coli (strain K12) GN=yggU PE=3 SV=2,ECOLI,25.268079857869242,25.267556056362306,25.53924884093885,25.102885187127807,24.956754766933013,25.159011448897825,24.877703619925192,25.974909563761766
P52061,P52061,dITP/XTP pyrophosphatase,rdgB,>sp|P52061|RDGB_ECOLI dITP/XTP pyrophosphatase OS=Escherichia coli (strain K12) GN=rdgB PE=1 SV=1,ECOLI,29.30100470078109,29.0196319743298,28.984467197130833,29.268219216448262,29.154078903886646,29.042967287527144,29.437839729722796,29.33320491151509
P52062,P52062,Oxygen-independent coproporphyrinogen-III oxidase-like protein YggW,yggW,>sp|P52062|YGGW_ECOLI Oxygen-independent coproporphyrinogen-III oxidase-like protein YggW OS=Escherichia coli (strain K12) GN=yggW PE=3 SV=1,ECOLI,24.748209579746568,24.687453395364596,27.82802280925964,24.632017663190993,24.89030034563643,25.10801175016726,24.317238485177704,24.568519231442934
P52076,P52076,Transcriptional regulatory protein QseB,qseB,>sp|P52076|QSEB_ECOLI Transcriptional regulatory protein qseB OS=Escherichia coli (strain K12) GN=qseB PE=2 SV=1,ECOLI,27.164716653737823,27.844100038588817,27.414302238452787,28.05168377294105,28.30096693778062,27.260353445977376,28.195971990341235,28.082674829542878
