P0A9C9,P0A9C9,"Fructose-1,6-bisphosphatase 1 class 2",glpX,">sp|P0A9C9|GLPX_ECOLI Fructose-1,6-bisphosphatase 1 class 2 OS=Escherichia coli (strain K12) GN=glpX PE=1 SV=1",ECOLI,29.705426466765037,29.74327961715694,29.56702814863696,29.734696169691624,29.69228463578506,29.79570467108796,29.63455356040734,29.456871770781355
P0A9D2,P0A9D2,Glutathione S-transferase GstA,gstA,>sp|P0A9D2|GSTA_ECOLI Glutathione S-transferase GstA OS=Escherichia coli (strain K12) GN=gstA PE=1 SV=1,ECOLI,32.31711465374049,32.511448849797546,32.42082979360937,32.68976490859025,32.36245239226653,32.49409876323833,32.614244074146214,32.583634183011725
P0A9D4,P0A9D4,Serine acetyltransferase,cysE,>sp|P0A9D4|CYSE_ECOLI Serine acetyltransferase OS=Escherichia coli (strain K12) GN=cysE PE=1 SV=1,ECOLI,28.92326209233097,29.21633933219059,28.846399845058077,29.11946220092371,29.39390322324274,28.75024154144338,29.387163924115047,29.291877275411903
P0A9D8,P0A9D8,"2,3,4,5-tetrahydropyridine-2,6-dicarboxylate N-succinyltransferase",dapD,">sp|P0A9D8|DAPD_ECOLI 2,3,4,5-tetrahydropyridine-2,6-dicarboxylate N-succinyltransferase OS=Escherichia coli (strain K12) GN=dapD PE=1 SV=1",ECOLI,32.32284197138169,32.53435115328783,32.335062000535544,32.482848780177065,32.53664484881206,32.4986644081869,32.587509502108304,32.682401011708365
P0A9E0,P0A9E0,Arabinose operon regulatory protein,araC,>sp|P0A9E0|ARAC_ECOLI Arabinose operon regulatory protein OS=Escherichia coli (strain K12) GN=araC PE=1 SV=1,ECOLI,25.12169037088772,25.845620963259698,25.18895192623019,25.699771955099617,25.664959464949252,25.286182208656797,26.00927701315875,25.539217412001282
P0A9F1,P0A9F1,Transcriptional regulator MntR,mntR,>sp|P0A9F1|MNTR_ECOLI Transcriptional regulator MntR OS=Escherichia coli (strain K12) GN=mntR PE=1 SV=1,ECOLI,24.866209653524876,25.680267469580293,24.85264786686506,25.53185676967758,26.23978959959033,25.01423287431101,25.531655011176824,25.138559875798276
P0A9F3,P0A9F3,HTH-type transcriptional regulator CysB,cysB,>sp|P0A9F3|CYSB_ECOLI HTH-type transcriptional regulator CysB OS=Escherichia coli (strain K12) GN=cysB PE=3 SV=1,ECOLI,30.713811487183094,30.51672749328189,30.131247115564232,30.176933375199017,30.362614223115013,30.271134619015665,30.39867632966958,30.266658251887666
P0A9F6,P0A9F6,Glycine cleavage system transcriptional activator,gcvA,>sp|P0A9F6|GCVA_ECOLI Glycine cleavage system transcriptional activator OS=Escherichia coli (strain K12) GN=gcvA PE=1 SV=1,ECOLI,25.15157416983808,25.43780637011791,25.436945199671037,25.76727165542462,25.715058363177956,25.34022826219118,25.750177675456438,25.782886492968146
P0A9G2,P0A9G2,Transcriptional activator protein nhaR,nhaR,>sp|P0A9G2|NHAR_ECOLI Transcriptional activator protein nhaR OS=Escherichia coli (strain K12) GN=nhaR PE=1 SV=1,ECOLI,24.116189816116634,24.156829238495774,24.996401342804994,24.916879821944445,24.455896227071925,24.88669461469042,24.99942402025169,24.977449578804343
P0A9G6,P0A9G6,Isocitrate lyase,aceA,>sp|P0A9G6|ACEA_ECOLI Isocitrate lyase OS=Escherichia coli (strain K12) GN=aceA PE=1 SV=1,ECOLI,33.85255803496887,34.4036882341716,33.92935176463361,34.38228294732794,34.37377708290748,34.04798914971964,34.534995426391205,34.370532861162914
P0A9G8,P0A9G8,Transcriptional regulator modE,modE,>sp|P0A9G8|MODE_ECOLI Transcriptional regulator modE OS=Escherichia coli (strain K12) GN=modE PE=1 SV=1,ECOLI,28.03693264062899,28.01206018437721,28.51832086113098,28.08169282952971,28.108437662996124,28.324421438035742,27.9926255274688,28.122684116796957
P0A9H1,P0A9H1,G/U mismatch-specific DNA glycosylase,mug,>sp|P0A9H1|MUG_ECOLI G/U mismatch-specific DNA glycosylase OS=Escherichia coli (strain K12) GN=mug PE=1 SV=1,ECOLI,30.00526006605338,30.1808013425761,29.863423676151495,30.06164458526461,30.270403548578848,29.917164054724168,30.121099606444812,29.93160602448872
P0A9H5,P0A9H5,"Cob(I)yrinic acid a,c-diamide adenosyltransferase",btuR,">sp|P0A9H5|BTUR_ECOLI Cob(I)yrinic acid a,c-diamide adenosyltransferase OS=Escherichia coli (strain K12) GN=btuR PE=3 SV=1",ECOLI,25.652142821997913,26.45004969099181,26.04506384455434,24.711046264770296,25.735036814671517,26.635317292616218,25.307310781577367,25.71716659103204
P0A9H7,P0A9H7,Cyclopropane-fatty-acyl-phospholipid synthase,cfa,>sp|P0A9H7|CFA_ECOLI Cyclopropane-fatty-acyl-phospholipid synthase OS=Escherichia coli (strain K12) GN=cfa PE=1 SV=2,ECOLI,26.68868697189829,26.4571118430258,25.14465771494987,26.58270565334793,26.995428701166936,26.096230826952855,26.34533060424041,26.137473992175916
P0A9I3,P0A9I3,Glycine cleavage system transcriptional repressor,gcvR,>sp|P0A9I3|GCVR_ECOLI Glycine cleavage system transcriptional repressor OS=Escherichia coli (strain K12) GN=gcvR PE=1 SV=2,ECOLI,27.631257485966106,27.803654392556783,27.53211099198993,27.45731850177885,27.974121507985036,27.422590552098423,27.441600422737615,27.596016552250518
P0A9J0,P0A9J0,Ribonuclease G,rng,>sp|P0A9J0|RNG_ECOLI Ribonuclease G OS=Escherichia coli (strain K12) GN=rng PE=1 SV=2,ECOLI,28.33238161259422,28.365718510510394,28.417481495063267,28.456338236856787,28.458539273997513,28.233442198131513,28.409717673098427,28.36743645713612
P0A9J4,P0A9J4,2-dehydropantoate 2-reductase,panE,>sp|P0A9J4|PANE_ECOLI 2-dehydropantoate 2-reductase OS=Escherichia coli (strain K12) GN=panE PE=1 SV=1,ECOLI,26.393312611954965,26.36784552924307,27.91062261524366,27.417417715379255,27.240353335855747,27.58825573817222,27.778071278324642,27.37243786659544
P0A9J6,P0A9J6,Ribokinase,rbsK,>sp|P0A9J6|RBSK_ECOLI Ribokinase OS=Escherichia coli (strain K12) GN=rbsK PE=1 SV=1,ECOLI,30.29368244736498,31.038443020503525,31.04270438893247,31.378794898518564,31.21382002021248,31.1193168309515,31.36966980873307,31.283936243319502
P0A9J8,P0A9J8,P-protein;Chorismate mutase;Prephenate dehydratase,pheA,>sp|P0A9J8|PHEA_ECOLI P-protein OS=Escherichia coli (strain K12) GN=pheA PE=1 SV=1,ECOLI,28.62229941004992,28.311142492628026,28.18013281037834,28.15650939700527,28.45275384045751,28.16400214986497,28.284179518798037,28.21185966224794
P0A9K3,P0A9K3,PhoH-like protein,ybeZ,>sp|P0A9K3|PHOL_ECOLI PhoH-like protein OS=Escherichia coli (strain K12) GN=ybeZ PE=1 SV=2,ECOLI,30.739910914096555,31.233398902654603,31.051952465734484,31.23570328375355,31.343173087858435,31.044269123963513,31.402952326260998,31.373234808244025
P0A9K7,P0A9K7,Phosphate transport system protein phoU,phoU,>sp|P0A9K7|PHOU_ECOLI Phosphate transport system protein phoU OS=Escherichia coli (strain K12) GN=phoU PE=1 SV=1,ECOLI,29.56157329574563,29.9340728435482,29.691066349899543,29.844658626871524,29.755419597283034,29.796863642321895,29.92293030353156,29.7691240672851
P0A9K9,P0A9K9,FKBP-type peptidyl-prolyl cis-trans isomerase slyD,slyD,>sp|P0A9K9|SLYD_ECOLI FKBP-type peptidyl-prolyl cis-trans isomerase slyD OS=Escherichia coli (strain K12) GN=slyD PE=1 SV=1,ECOLI,29.734743045737616,30.743526351195264,30.788703366560643,31.40285790320459,31.101628104998863,30.871030266713333,31.5557137140028,30.936012939899193
P0A9L3,P0A9L3,FKBP-type 22 kDa peptidyl-prolyl cis-trans isomerase,fklB,>sp|P0A9L3|FKBB_ECOLI FKBP-type 22 kDa peptidyl-prolyl cis-trans isomerase OS=Escherichia coli (strain K12) GN=fklB PE=1 SV=2,ECOLI,31.918059859974655,31.97758447103784,31.917999374262852,32.15824659564552,32.08233483971274,31.97373665155369,32.01463999958629,31.977496471810007
P0A9L5,P0A9L5,Peptidyl-prolyl cis-trans isomerase C,ppiC,>sp|P0A9L5|PPIC_ECOLI Peptidyl-prolyl cis-trans isomerase C OS=Escherichia coli (strain K12) GN=ppiC PE=1 SV=2,ECOLI,29.67985547005487,29.900669996903396,29.452936135955913,29.899594137698134,30.15430327131727,29.644548147556108,29.599828210222228,29.69438274373895
P0A9L8,P0A9L8,Pyrroline-5-carboxylate reductase,proC,>sp|P0A9L8|P5CR_ECOLI Pyrroline-5-carboxylate reductase OS=Escherichia coli (strain K12) GN=proC PE=1 SV=1,ECOLI,30.937276997426775,31.405482518017926,31.762203790027158,31.941634778692247,31.899310546903116,31.78171610003143,31.830792083990545,31.85504039784771
P0A9M0,P0A9M0,Lon protease,lon,>sp|P0A9M0|LON_ECOLI Lon protease OS=Escherichia coli (strain K12) GN=lon PE=1 SV=1,ECOLI,32.29833618847517,32.43363682251531,32.30074706828684,32.337172528410164,32.55618610720143,32.35564462538059,32.417645273751575,32.51345663085952
P0A9M2,P0A9M2,Hypoxanthine phosphoribosyltransferase,hpt,>sp|P0A9M2|HPRT_ECOLI Hypoxanthine phosphoribosyltransferase OS=Escherichia coli (strain K12) GN=hpt PE=1 SV=1,ECOLI,29.0247280764096,29.217476618535617,29.301687320663273,29.273393609403122,29.355498120075556,29.1732896364655,29.41091708708539,29.30754163102138
P0A9M5,P0A9M5,Xanthine phosphoribosyltransferase,gpt,>sp|P0A9M5|XGPT_ECOLI Xanthine phosphoribosyltransferase OS=Escherichia coli (strain K12) GN=gpt PE=1 SV=1,ECOLI,29.63613156455301,29.47535446919844,29.58738471474904,29.201314608324342,29.50128435329811,29.48769205796589,29.667275428063363,29.352518787885007
P0A9M8,P0A9M8,Phosphate acetyltransferase,pta,>sp|P0A9M8|PTA_ECOLI Phosphate acetyltransferase OS=Escherichia coli (strain K12) GN=pta PE=1 SV=2,ECOLI,32.91967373687353,33.051887432270235,33.03352455654239,33.020105437272534,33.15135566866036,33.03947908983929,33.08359316084612,32.99897178310847
P0A9N0,P0A9N0,Phosphocarrier protein NPr,ptsO,>sp|P0A9N0|PTSO_ECOLI Phosphocarrier protein NPr OS=Escherichia coli (strain K12) GN=ptsO PE=1 SV=1,ECOLI,24.94839171410895,24.858265771558287,25.313811981826138,24.59098986067058,24.184696862443833,25.289804465833136,23.712801392225725,25.050299977032807
P0A9N4,P0A9N4,Pyruvate formate-lyase 1-activating enzyme,pflA,>sp|P0A9N4|PFLA_ECOLI Pyruvate formate-lyase 1-activating enzyme OS=Escherichia coli (strain K12) GN=pflA PE=1 SV=2,ECOLI,29.784635008667586,30.046731320962476,29.654174917659883,29.544859735456782,29.675985749919743,29.80304452765967,29.64515852579369,29.738069805003136
P0A9P0,P0A9P0,Dihydrolipoyl dehydrogenase,lpdA,>sp|P0A9P0|DLDH_ECOLI Dihydrolipoyl dehydrogenase OS=Escherichia coli (strain K12) GN=lpdA PE=1 SV=2,ECOLI,34.35838246377119,34.83663318565799,34.65854595333582,34.76398703311261,34.8878684517728,34.70363065868192,34.964187379587926,34.93823793307607
P0A9P4,P0A9P4,Thioredoxin reductase,trxB,>sp|P0A9P4|TRXB_ECOLI Thioredoxin reductase OS=Escherichia coli (strain K12) GN=trxB PE=1 SV=2,ECOLI,31.274371866636702,31.370018425325664,31.463513056586873,31.745658528395126,31.670819501614993,31.510015704652123,31.934757025761513,32.01694841974448
P0A9Q1;A5PFK0;A5PFJ8,P0A9Q1;A5PFK0,Aerobic respiration control protein ArcA,arcA;arcA2,>sp|P0A9Q1|ARCA_ECOLI Aerobic respiration control protein ArcA OS=Escherichia coli (strain K12) GN=arcA PE=1 SV=1;>tr|A5PFK0|A5PFK0_ECOLI Disrupted ArcA (Fragment) OS=Escherichia coli (strain K12) GN=arcA2 PE=4 SV=1,ECOLI,32.9529847118806,33.038359226191986,33.11847603445284,32.847289647122295,33.0060172407606,33.134141090931735,32.98227791611028,32.936899802634684
P0A9Q5;P0A9U8,P0A9Q5,Acetyl-coenzyme A carboxylase carboxyl transferase subunit beta,accD,>sp|P0A9Q5|ACCD_ECOLI Acetyl-coenzyme A carboxylase carboxyl transferase subunit beta OS=Escherichia coli (strain K12) GN=accD PE=1 SV=1,ECOLI,30.8096996422953,30.91060678257342,30.890016243357138,30.80404018831382,30.877165819547116,31.035982437821794,31.00199440133562,31.015672975612514
P0A9Q7,P0A9Q7,Aldehyde-alcohol dehydrogenase;Alcohol dehydrogenase;Acetaldehyde dehydrogenase [acetylating];Pyruvate-formate-lyase deactivase,adhE,>sp|P0A9Q7|ADHE_ECOLI Aldehyde-alcohol dehydrogenase OS=Escherichia coli (strain K12) GN=adhE PE=1 SV=2,ECOLI,34.208134848322956,34.76313973830298,34.56198026935576,34.69953254413248,34.80142130955491,34.546566608437175,34.734692327111944,34.76987878416068
P0A9Q9,P0A9Q9,Aspartate-semialdehyde dehydrogenase,asd,>sp|P0A9Q9|DHAS_ECOLI Aspartate-semialdehyde dehydrogenase OS=Escherichia coli (strain K12) GN=asd PE=1 SV=1,ECOLI,30.24463482875931,31.26782825628505,31.452457868077875,31.682385057413622,31.624110502467747,31.526690655214423,31.602831390816895,31.702482528375484
P0A9R4,P0A9R4,2Fe-2S ferredoxin,fdx,>sp|P0A9R4|FER_ECOLI 2Fe-2S ferredoxin OS=Escherichia coli (strain K12) GN=fdx PE=1 SV=2,ECOLI,31.50125874561339,31.171295461488914,30.700345099092807,30.688492331922056,30.80770506362483,31.198508631813585,31.03497584565049,31.045253098803588
P0A9R7,P0A9R7,Cell division ATP-binding protein FtsE,ftsE,>sp|P0A9R7|FTSE_ECOLI Cell division ATP-binding protein FtsE OS=Escherichia coli (strain K12) GN=ftsE PE=1 SV=1,ECOLI,29.72843040714166,29.54840497090318,29.291241150719845,29.187203398802282,29.497889752080493,29.106337488651473,29.27516291900427,29.176348297473854
P0A9S1,P0A9S1,Lactaldehyde reductase,fucO,>sp|P0A9S1|FUCO_ECOLI Lactaldehyde reductase OS=Escherichia coli (strain K12) GN=fucO PE=1 SV=2,ECOLI,29.181632425396355,29.828755437563984,29.792759454488525,30.086186458887244,30.028851702704387,29.828096260764475,30.095344212760825,30.151942700961843
P0A9S5,P0A9S5,Glycerol dehydrogenase,gldA,>sp|P0A9S5|GLDA_ECOLI Glycerol dehydrogenase OS=Escherichia coli (strain K12) GN=gldA PE=1 SV=1,ECOLI,28.68583344525667,29.302504907405087,29.140421488319465,29.321150986436965,29.36853551997986,29.329641313684448,29.298831142910867,29.19005338754007
P0A9T0,P0A9T0,D-3-phosphoglycerate dehydrogenase,serA,>sp|P0A9T0|SERA_ECOLI D-3-phosphoglycerate dehydrogenase OS=Escherichia coli (strain K12) GN=serA PE=1 SV=2,ECOLI,30.31951378796299,30.081890234873917,29.974055183898386,29.92319967019571,30.27316095014942,30.13492032733063,29.95452949847675,30.193025933695914
P0A9T4,P0A9T4,Protein tas,tas,>sp|P0A9T4|TAS_ECOLI Protein tas OS=Escherichia coli (strain K12) GN=tas PE=1 SV=1,ECOLI,28.851494072414805,29.184561996062882,29.276293706637116,29.502503476684897,29.319247980015987,29.36132231973645,29.197941983152784,29.6570502380239
P0A9T8,P0A9T8,Uncharacterized ABC transporter ATP-binding protein YbbA,ybbA,>sp|P0A9T8|YBBA_ECOLI Uncharacterized ABC transporter ATP-binding protein YbbA OS=Escherichia coli (strain K12) GN=ybbA PE=3 SV=1,ECOLI,30.305446123172462,29.675516661945437,28.51843053702898,30.248217868534212,30.033873554194205,30.114862919389665,29.977782827363264,29.911361164162372
P0A9U1,P0A9U1,Uncharacterized ABC transporter ATP-binding protein YbhF,ybhF,>sp|P0A9U1|YBHF_ECOLI Uncharacterized ABC transporter ATP-binding protein YbhF OS=Escherichia coli (strain K12) GN=ybhF PE=1 SV=1,ECOLI,22.88697253480252,23.99461991356938,23.750026852117692,24.996290671190586,24.607096557244763,NA,24.90891753990032,24.53891837685856
P0A9U3,P0A9U3,Uncharacterized ABC transporter ATP-binding protein YbiT,ybiT,>sp|P0A9U3|YBIT_ECOLI Uncharacterized ABC transporter ATP-binding protein YbiT OS=Escherichia coli (strain K12) GN=ybiT PE=3 SV=1,ECOLI,29.308966261362176,29.440004371405156,29.621174803027422,29.479431811566187,29.42144490818285,29.602606789598173,29.602962582678966,29.63015857574527
P0A9V1,P0A9V1,Lipopolysaccharide export system ATP-binding protein LptB,lptB,>sp|P0A9V1|LPTB_ECOLI Lipopolysaccharide export system ATP-binding protein LptB OS=Escherichia coli (strain K12) GN=lptB PE=1 SV=2,ECOLI,29.398706808960913,29.66322300635789,29.600878480445264,29.787672874509287,29.82977099082791,29.654214912035158,29.68660104927369,29.892672352606546
P0A9W0,P0A9W0,HTH-type transcriptional regulator UlaR,ulaR,>sp|P0A9W0|ULAR_ECOLI HTH-type transcriptional regulator ulaR OS=Escherichia coli (strain K12) GN=ulaR PE=1 SV=1,ECOLI,28.441011842680904,28.47666116860708,27.531459024648463,27.249395467917182,27.834803589640355,27.8064396660768,28.148202356644195,27.06819028368216
P0A9W3,P0A9W3,Uncharacterized ABC transporter ATP-binding protein YjjK,yjjK,>sp|P0A9W3|YJJK_ECOLI Uncharacterized ABC transporter ATP-binding protein YjjK OS=Escherichia coli (strain K12) GN=yjjK PE=1 SV=2,ECOLI,32.891102370788424,33.13473509789286,33.14463166200153,33.225699159197674,33.334783867812476,33.16982575970886,33.280427625397834,33.39345600544304
P0A9W6,P0A9W6,Uncharacterized protein YrbA,yrbA,>sp|P0A9W6|YRBA_ECOLI Uncharacterized protein YrbA OS=Escherichia coli (strain K12) GN=yrbA PE=1 SV=1,ECOLI,26.841058234616238,27.465336817620816,27.355107268842264,26.95266724118807,27.37102596115819,27.046791341462583,27.13877420132363,27.161468047930846
P0A9W9,P0A9W9,Protein YrdA,yrdA,>sp|P0A9W9|YRDA_ECOLI Protein YrdA OS=Escherichia coli (strain K12) GN=yrdA PE=1 SV=1,ECOLI,30.095266385937556,29.87996038922168,29.939796816191894,29.646650057229184,29.74939237168504,30.014557022306143,29.445761003533132,29.97811697098891
P0A9X4,P0A9X4,Rod shape-determining protein MreB,mreB,>sp|P0A9X4|MREB_ECOLI Rod shape-determining protein MreB OS=Escherichia coli (strain K12) GN=mreB PE=1 SV=1,ECOLI,32.57690789767603,32.457722525429375,32.56886939965639,32.446829489767694,32.45620058575574,32.64336744936361,32.500893109909754,32.78651530564724
P0A9Y6,P0A9Y6,Cold shock-like protein CspC,cspC,>sp|P0A9Y6|CSPC_ECOLI Cold shock-like protein CspC OS=Escherichia coli (strain K12) GN=cspC PE=1 SV=2,ECOLI,31.412976727258094,31.945950192560634,31.417403079200607,32.10097085130444,32.059456185787255,31.727479933104174,32.177890989459925,31.96262837619034
P0A9Z1,P0A9Z1,Nitrogen regulatory protein P-II 1,glnB,>sp|P0A9Z1|GLNB_ECOLI Nitrogen regulatory protein P-II 1 OS=Escherichia coli (strain K12) GN=glnB PE=1 SV=1,ECOLI,30.068700829486176,29.913752859168607,29.633108898159882,29.77119657675066,29.9127455229675,30.0977864557673,29.333167657277713,29.42026319938697
P0AA04,P0AA04,Phosphocarrier protein HPr,ptsH,>sp|P0AA04|PTHP_ECOLI Phosphocarrier protein HPr OS=Escherichia coli (strain K12) GN=ptsH PE=1 SV=1,ECOLI,31.8925694337075,31.979471123577266,32.023126940728474,32.14087127641518,32.14971550564765,32.20925539292374,32.33101504216864,32.22393151755733
P0AA10,P0AA10,50S ribosomal protein L13,rplM,>sp|P0AA10|RL13_ECOLI 50S ribosomal protein L13 OS=Escherichia coli (strain K12) GN=rplM PE=1 SV=1,ECOLI,33.28447705814779,33.2187727422086,33.249801177356446,33.049946534657394,33.04507560199869,33.475907399504166,33.42458966762137,33.21115898968439
P0AA16,P0AA16,Transcriptional regulatory protein OmpR,ompR,>sp|P0AA16|OMPR_ECOLI Transcriptional regulatory protein OmpR OS=Escherichia coli (strain K12) GN=ompR PE=1 SV=1,ECOLI,32.060003664802686,32.163909660717195,32.03866353564966,32.033296506468744,32.14639824443917,32.278094997246754,32.16932303487201,32.27848910039248
P0AA25,P0AA25,Thioredoxin-1,trxA,>sp|P0AA25|THIO_ECOLI Thioredoxin-1 OS=Escherichia coli (strain K12) GN=trxA PE=1 SV=2,ECOLI,32.28523823875735,32.76010441860636,32.54585126314362,32.64031950958672,32.83223884621326,32.52587544823717,32.638168343429605,32.94686603700447
P0AA31,P0AA31,UPF0033 protein yedF,yedF,>sp|P0AA31|YEDF_ECOLI UPF0033 protein yedF OS=Escherichia coli (strain K12) GN=yedF PE=1 SV=1,ECOLI,27.592359016568903,28.069819588953603,27.446168263062997,27.601697211848062,28.055123664909743,27.3842029826959,28.222308415424838,27.669294707011456
P0AA39,P0AA39,Ribosomal large subunit pseudouridine synthase C,rluC,>sp|P0AA39|RLUC_ECOLI Ribosomal large subunit pseudouridine synthase C OS=Escherichia coli (strain K12) GN=rluC PE=1 SV=1,ECOLI,29.10804601791514,28.573436865082737,28.88839059166807,28.43830061365187,28.446090110176502,29.090722478621263,28.453832997922845,28.795696230257768
P0AA41,P0AA41,tRNA pseudouridine synthase C,truC,>sp|P0AA41|TRUC_ECOLI tRNA pseudouridine synthase C OS=Escherichia coli (strain K12) GN=truC PE=1 SV=1,ECOLI,24.648947428813003,23.845866123598267,23.756984402830135,23.94358502622262,24.128878569423627,24.928127248845513,24.552730263440324,23.67892101521877
P0AA43,P0AA43,Ribosomal small subunit pseudouridine synthase A,rsuA,>sp|P0AA43|RSUA_ECOLI Ribosomal small subunit pseudouridine synthase A OS=Escherichia coli (strain K12) GN=rsuA PE=1 SV=1,ECOLI,29.586075664855823,29.780307141403892,29.600705836988958,29.66485734668598,29.83253096661859,29.570674052529704,29.84294370300344,29.776324563191167
P0AA53,P0AA53,Protein QmcA,qmcA,>sp|P0AA53|QMCA_ECOLI Protein QmcA OS=Escherichia coli (strain K12) GN=qmcA PE=1 SV=1,ECOLI,28.738505938242383,29.497857575966552,29.465770840303296,29.63474115388359,29.715463899383266,29.480324108772944,29.66266764694782,29.728857641477255
P0AA57,P0AA57,Protein YobA,yobA,>sp|P0AA57|YOBA_ECOLI Protein YobA OS=Escherichia coli (strain K12) GN=yobA PE=1 SV=1,ECOLI,26.325293685883032,26.174583292077088,25.478338268723903,25.59828859823434,26.12403983065719,26.045834977986807,25.11532314001149,25.541577613155773
P0AA60,P0AA60,Inner membrane protein YghB,yghB,>sp|P0AA60|YGHB_ECOLI Inner membrane protein YghB OS=Escherichia coli (strain K12) GN=yghB PE=1 SV=1,ECOLI,22.35526285807885,22.501804611296105,22.45782983381669,23.217339427011012,22.997315438192462,22.41926148381071,22.671444915317984,22.768388963976975
P0AA89,P0AA89,Diguanylate cyclase DosC,dosC,>sp|P0AA89|DOSC_ECOLI Diguanylate cyclase DosC OS=Escherichia coli (strain K12) GN=dosC PE=1 SV=1,ECOLI,25.207491982368747,25.647030266304697,25.71931398486408,25.665274814285212,25.592187194228504,25.52072668651318,26.029574846627266,25.829965721043273
P0AA91,P0AA91,Uncharacterized lipoprotein yeaY,yeaY,>sp|P0AA91|YEAY_ECOLI Uncharacterized lipoprotein yeaY OS=Escherichia coli (strain K12) GN=yeaY PE=4 SV=1,ECOLI,30.6530166632039,31.060726265711814,30.448242259964868,30.53872303668591,30.875730264385233,30.38781732050837,30.813209936295163,30.72869377334431
P0AA97,P0AA97,Uncharacterized protein yaeQ,yaeQ,>sp|P0AA97|YAEQ_ECOLI Uncharacterized protein yaeQ OS=Escherichia coli (strain K12) GN=yaeQ PE=1 SV=1,ECOLI,NA,22.89159259219931,22.96708614544832,23.15372745595811,22.875424835778855,NA,22.93016707407804,22.564952036239468
P0AAB4,P0AAB4,3-octaprenyl-4-hydroxybenzoate carboxy-lyase,ubiD,>sp|P0AAB4|UBID_ECOLI 3-octaprenyl-4-hydroxybenzoate carboxy-lyase OS=Escherichia coli (strain K12) GN=ubiD PE=1 SV=1,ECOLI,28.705925369641175,29.318845856961573,29.317237123398385,29.44309843307589,29.316020348491485,29.35205906200715,29.555433543066925,29.536018260699226
P0AAB6,P0AAB6,UTP--glucose-1-phosphate uridylyltransferase,galF,>sp|P0AAB6|GALF_ECOLI UTP--glucose-1-phosphate uridylyltransferase OS=Escherichia coli (strain K12) GN=galF PE=1 SV=1,ECOLI,30.885559224232225,31.409841900572825,31.240052174468392,31.76010955140178,31.641554014386276,31.259972512728368,31.618662878098288,31.758536430059863
P0AAB8,P0AAB8,Universal stress protein D,uspD,>sp|P0AAB8|USPD_ECOLI Universal stress protein D OS=Escherichia coli (strain K12) GN=uspD PE=2 SV=1,ECOLI,28.416979404663678,28.85920725056204,28.884850233962823,28.88835741645078,28.920050621280858,28.859081345747068,28.841565622067076,28.33257964483337
P0AAC0,P0AAC0,Universal stress protein E,uspE,>sp|P0AAC0|USPE_ECOLI Universal stress protein E OS=Escherichia coli (strain K12) GN=uspE PE=1 SV=2,ECOLI,31.566179096523168,32.38359134269771,32.28796383044963,32.40089763294917,32.66464186155454,32.30774805479942,32.58166333390959,32.538329470223786
P0AAC4,P0AAC4,Inner membrane protein YbhL,ybhL,>sp|P0AAC4|YBHL_ECOLI Inner membrane protein YbhL OS=Escherichia coli (strain K12) GN=ybhL PE=1 SV=1,ECOLI,24.1437625338182,23.939539238716474,24.439326012653584,23.870865735028158,23.88996505237686,23.969017431178138,NA,23.59453536785938
P0AAC8,P0AAC8,Iron-binding protein IscA,iscA,>sp|P0AAC8|ISCA_ECOLI Iron-binding protein iscA OS=Escherichia coli (strain K12) GN=iscA PE=1 SV=1,ECOLI,25.241055214491116,25.719621932084902,25.16112344515009,25.734343606895493,25.957166344885497,25.603313542681864,25.79408159908428,25.447944716811072
P0AAD2,P0AAD2,Tryptophan-specific transport protein,mtr,>sp|P0AAD2|MTR_ECOLI Tryptophan-specific transport protein OS=Escherichia coli (strain K12) GN=mtr PE=1 SV=1,ECOLI,NA,22.886205737683046,23.636151186388297,23.940268175318508,23.384995512929663,23.750917835659955,23.629857071316383,23.26597365021309
P0AAD6,P0AAD6,Serine transporter,sdaC,>sp|P0AAD6|SDAC_ECOLI Serine transporter OS=Escherichia coli (strain K12) GN=sdaC PE=1 SV=1,ECOLI,28.903030888193342,28.53301481586049,27.891386022480592,26.611874996852094,27.667714341865842,28.14218513462123,27.32241481133826,27.240829669821508
P0AAE0,P0AAE0,D-serine/D-alanine/glycine transporter,cycA,>sp|P0AAE0|CYCA_ECOLI D-serine/D-alanine/glycine transporter OS=Escherichia coli (strain K12) GN=cycA PE=1 SV=1,ECOLI,27.367604932369783,27.045157534719337,26.620050903669362,26.852623022437317,26.596934477157603,26.76111306372583,27.06196162054181,27.035071610621863
P0AAF6,P0AAF6,Arginine transport ATP-binding protein ArtP,artP,>sp|P0AAF6|ARTP_ECOLI Arginine transport ATP-binding protein ArtP OS=Escherichia coli (strain K12) GN=artP PE=1 SV=1,ECOLI,29.73085495972868,29.862437013418013,29.714934094256442,30.02244205439607,29.976943130321757,29.920428874924035,30.068867396277255,30.187790149179957
P0AAG0,P0AAG0,Dipeptide transport ATP-binding protein DppD,dppD,>sp|P0AAG0|DPPD_ECOLI Dipeptide transport ATP-binding protein DppD OS=Escherichia coli (strain K12) GN=dppD PE=3 SV=1,ECOLI,27.540979930873988,26.880932681724932,26.705636624692872,26.766411357042667,26.93460883473196,27.159684280469115,27.14089609573606,27.154067598178596
P0AAG3,P0AAG3,Glutamate/aspartate transport ATP-binding protein GltL,gltL,>sp|P0AAG3|GLTL_ECOLI Glutamate/aspartate transport ATP-binding protein GltL OS=Escherichia coli (strain K12) GN=gltL PE=3 SV=1,ECOLI,27.796284995963987,27.17815087100268,27.230499082992033,26.690010949637895,26.937508725237755,27.46636810917136,26.739066111131375,26.832334739104628
P0AAG8;P32721,P0AAG8,Galactose/methyl galactoside import ATP-binding protein MglA,mglA,>sp|P0AAG8|MGLA_ECOLI Galactose/methyl galactoside import ATP-binding protein MglA OS=Escherichia coli (strain K12) GN=mglA PE=1 SV=1,ECOLI,31.10820144126506,31.00226430187343,31.17231236397569,31.19596859513197,31.130995491835307,31.110457361337087,31.000202521899983,31.153835721329003
