P0AFZ1,P0AFZ1,Protein sseB,sseB,>sp|P0AFZ1|SSEB_ECOLI Protein sseB OS=Escherichia coli (strain K12) GN=sseB PE=4 SV=1,ECOLI,27.14260100635783,26.959161836573404,27.17564268373825,26.825669470391748,27.310393710129272,27.328701419342828,26.7404661064289,26.63717747026567
P0AFZ3,P0AFZ3,Stringent starvation protein B,sspB,>sp|P0AFZ3|SSPB_ECOLI Stringent starvation protein B OS=Escherichia coli (strain K12) GN=sspB PE=1 SV=1,ECOLI,26.259005120723145,27.183301449856966,26.943559019341393,27.682921524851576,27.808623987786095,26.986416058913868,27.721837211518725,27.750633172353833
P0AG00,P0AG00,Lipopolysaccharide biosynthesis protein wzzE,wzzE,>sp|P0AG00|WZZE_ECOLI Lipopolysaccharide biosynthesis protein wzzE OS=Escherichia coli (strain K12) GN=wzzE PE=1 SV=2,ECOLI,27.957727018387303,28.446626848741307,28.29658027957969,28.616972181304913,28.51173184776428,28.341042041496888,28.52276224833542,28.533712722286328
P0AG03,P0AG03,3-octaprenyl-4-hydroxybenzoate carboxy-lyase,ubiX,>sp|P0AG03|UBIX_ECOLI 3-octaprenyl-4-hydroxybenzoate carboxy-lyase OS=Escherichia coli (strain K12) GN=ubiX PE=3 SV=1,ECOLI,NA,22.136515084235295,22.594587845223803,22.68877214471217,22.76234576072741,22.791769591253328,22.51387982342645,NA
P0AG07,P0AG07,Ribulose-phosphate 3-epimerase,rpe,>sp|P0AG07|RPE_ECOLI Ribulose-phosphate 3-epimerase OS=Escherichia coli (strain K12) GN=rpe PE=1 SV=1,ECOLI,29.69715480218225,30.608175846457893,30.460757191296363,30.829702354265464,31.035836819375326,30.476413815600477,30.82667874939575,31.01949593023699
P0AG14,P0AG14,Probable protease sohB,sohB,>sp|P0AG14|SOHB_ECOLI Probable protease sohB OS=Escherichia coli (strain K12) GN=sohB PE=1 SV=1,ECOLI,29.8845873851649,29.882113509584514,29.892063370608792,29.9859535402952,30.079613731580974,29.99031172745798,30.115715496565688,30.044924084448155
P0AG16,P0AG16,Amidophosphoribosyltransferase,purF,>sp|P0AG16|PUR1_ECOLI Amidophosphoribosyltransferase OS=Escherichia coli (strain K12) GN=purF PE=1 SV=2,ECOLI,27.592359016568903,27.559901506382086,26.96592850786584,27.358359472928672,27.45015702114302,26.8160440063123,27.113850851853417,27.095287799893665
P0AG18,P0AG18,N5-carboxyaminoimidazole ribonucleotide mutase,purE,>sp|P0AG18|PURE_ECOLI N5-carboxyaminoimidazole ribonucleotide mutase OS=Escherichia coli (strain K12) GN=purE PE=1 SV=2,ECOLI,24.135071782971107,24.40234183664665,23.73308973550222,24.787367325129562,24.59298194591612,23.774704345274543,24.87677798468178,24.836282590365002
P0AG20,P0AG20,GTP pyrophosphokinase,relA,>sp|P0AG20|RELA_ECOLI GTP pyrophosphokinase OS=Escherichia coli (strain K12) GN=relA PE=1 SV=1,ECOLI,28.742659559921343,28.601258343269965,28.319378960545592,28.61437310978139,28.7352634721805,28.374465043034338,28.647466946983183,28.721745050257002
P0AG24,P0AG24,"Bifunctional (p)ppGpp synthase/hydrolase SpoT;GTP pyrophosphokinase;Guanosine-3,5-bis(diphosphate) 3-pyrophosphohydrolase",spoT,>sp|P0AG24|SPOT_ECOLI Bifunctional (p)ppGpp synthase/hydrolase SpoT OS=Escherichia coli (strain K12) GN=spoT PE=1 SV=1,ECOLI,29.87274327978369,29.59114857092933,29.614640545581945,29.462873805869172,29.546469932525554,29.860101822350725,29.95849953051047,29.457089394223775
P0AG27,P0AG27,Uncharacterized protein yibN,yibN,>sp|P0AG27|YIBN_ECOLI Uncharacterized protein yibN OS=Escherichia coli (strain K12) GN=yibN PE=1 SV=1,ECOLI,30.496262467476157,31.1728841309588,30.7846814384283,31.096164428906366,31.255375339346514,30.694404470615755,31.17380473980895,31.18241564262574
P0AG30,P0AG30,Transcription termination factor Rho,rho,>sp|P0AG30|RHO_ECOLI Transcription termination factor Rho OS=Escherichia coli (strain K12) GN=rho PE=1 SV=1,ECOLI,33.09456615050135,33.079318672314685,33.015441160497744,32.938110513244695,33.06160096315972,32.90589349968096,33.07379796293016,33.127011442434494
P0AG40,P0AG40,Riboflavin biosynthesis protein RibF;Riboflavin kinase;FMN adenylyltransferase,ribF,>sp|P0AG40|RIBF_ECOLI Riboflavin biosynthesis protein ribF OS=Escherichia coli (strain K12) GN=ribF PE=1 SV=1,ECOLI,27.90144311679788,28.285253817641525,28.150198657117983,28.290325415372,28.202039127133666,27.945476829857295,28.407716431217136,28.276556712953905
P0AG44,P0AG44,50S ribosomal protein L17,rplQ,>sp|P0AG44|RL17_ECOLI 50S ribosomal protein L17 OS=Escherichia coli (strain K12) GN=rplQ PE=1 SV=1,ECOLI,32.54333009276625,32.42868410334901,32.47104104280268,32.36525397968033,32.41408821625012,32.69004468029539,32.62498590750822,33.02133672173724
P0AG48,P0AG48,50S ribosomal protein L21,rplU,>sp|P0AG48|RL21_ECOLI 50S ribosomal protein L21 OS=Escherichia coli (strain K12) GN=rplU PE=1 SV=1,ECOLI,32.25309345447224,32.03169037498968,32.51535645582341,32.18076649954392,31.981586776013305,32.51490699814764,32.40053920370087,32.329141229965984
P0AG51,P0AG51,50S ribosomal protein L30,rpmD,>sp|P0AG51|RL30_ECOLI 50S ribosomal protein L30 OS=Escherichia coli (strain K12) GN=rpmD PE=1 SV=2,ECOLI,31.576085431992254,31.53940471342298,31.83295510480187,31.545744813154343,31.682879990476035,31.821892968150966,30.691906292600386,31.386331571009656
P0AG55,P0AG55,50S ribosomal protein L6,rplF,>sp|P0AG55|RL6_ECOLI 50S ribosomal protein L6 OS=Escherichia coli (strain K12) GN=rplF PE=1 SV=2,ECOLI,33.9903100350591,34.17172335231621,34.27612074495117,33.94544740918474,34.136826294456725,34.238097040414445,34.1489812687852,34.170912824396865
P0AG59,P0AG59,30S ribosomal protein S14,rpsN,>sp|P0AG59|RS14_ECOLI 30S ribosomal protein S14 OS=Escherichia coli (strain K12) GN=rpsN PE=1 SV=2,ECOLI,31.546938267317902,31.57061200028067,31.485232216518426,31.171567752514306,31.39651890370821,31.663774987195023,31.567593369748398,31.15980382245316
P0AG63,P0AG63,30S ribosomal protein S17,rpsQ,>sp|P0AG63|RS17_ECOLI 30S ribosomal protein S17 OS=Escherichia coli (strain K12) GN=rpsQ PE=1 SV=2,ECOLI,30.526150032386962,31.145137954668773,31.332205229165943,30.691577955024535,31.031025459651488,31.485834432363728,31.841988077098986,31.600322036791592
P0AG67,P0AG67,30S ribosomal protein S1,rpsA,>sp|P0AG67|RS1_ECOLI 30S ribosomal protein S1 OS=Escherichia coli (strain K12) GN=rpsA PE=1 SV=1,ECOLI,34.73017887600063,35.00966018319329,34.91041020098014,35.042821497043775,35.071378223384826,34.95189690577047,35.09598130486254,34.9955452250713
P0AG71,P0AG71,DNA recombination protein rmuC,rmuC,>sp|P0AG71|RMUC_ECOLI DNA recombination protein rmuC OS=Escherichia coli (strain K12) GN=rmuC PE=1 SV=1,ECOLI,26.819414980388025,27.475908971074105,26.853807310020677,26.79299400972986,26.811408869838836,26.61961376718987,26.73524102261341,26.866934557160143
P0AG76,P0AG76,Nuclease sbcCD subunit D,sbcD,>sp|P0AG76|SBCD_ECOLI Nuclease sbcCD subunit D OS=Escherichia coli (strain K12) GN=sbcD PE=1 SV=1,ECOLI,23.535284241928505,24.077794405388733,23.51321537086828,24.382950656981123,24.54438281910484,23.59364345549057,23.657391709030865,23.808616512973366
P0AG78,P0AG78,Sulfate-binding protein,sbp,>sp|P0AG78|SUBI_ECOLI Sulfate-binding protein OS=Escherichia coli (strain K12) GN=sbp PE=1 SV=1,ECOLI,29.91549292724303,29.96980220701894,29.94143376232919,30.12025463200679,30.084854660206766,30.053995631933407,29.820659662259406,29.949434769935554
P0AG80,P0AG80,sn-glycerol-3-phosphate-binding periplasmic protein ugpB,ugpB,>sp|P0AG80|UGPB_ECOLI sn-glycerol-3-phosphate-binding periplasmic protein ugpB OS=Escherichia coli (strain K12) GN=ugpB PE=3 SV=1,ECOLI,32.04532321515255,32.24320366397144,32.34825932439472,32.266760568368994,32.151121473790454,32.26044866357566,32.32540740523309,32.24479429452997
P0AG82,P0AG82,Phosphate-binding protein pstS,pstS,>sp|P0AG82|PSTS_ECOLI Phosphate-binding protein pstS OS=Escherichia coli (strain K12) GN=pstS PE=1 SV=1,ECOLI,32.94136408752453,33.23933057664708,33.31175783846727,33.222531564023015,33.19018555558918,33.43120421870282,33.20723987651797,33.32978959581742
P0AG84,P0AG84,Uncharacterized oxidoreductase yghA,yghA,>sp|P0AG84|YGHA_ECOLI Uncharacterized oxidoreductase yghA OS=Escherichia coli (strain K12) GN=yghA PE=1 SV=1,ECOLI,30.39725385229161,31.1715399860727,31.003541370566218,31.40005670107311,31.355259588191895,31.053866375557305,31.17827256551846,31.290556801758186
P0AG86,P0AG86,Protein-export protein SecB,secB,>sp|P0AG86|SECB_ECOLI Protein-export protein SecB OS=Escherichia coli (strain K12) GN=secB PE=1 SV=1,ECOLI,31.2279249671245,31.73457585936422,32.50982769525301,32.50790199786607,32.16033562784263,32.44504461055506,32.28097435966904,32.243934592231625
P0AG90,P0AG90,Protein translocase subunit SecD,secD,>sp|P0AG90|SECD_ECOLI Protein translocase subunit SecD OS=Escherichia coli (strain K12) GN=secD PE=1 SV=1,ECOLI,29.89453392750944,29.956524912029995,29.850979533156067,30.062289019563476,30.051648255922178,30.059671478113252,29.99267893193829,29.98705009575892
P0AG93,P0AG93,Protein translocase subunit SecF,secF,>sp|P0AG93|SECF_ECOLI Protein translocase subunit SecF OS=Escherichia coli (strain K12) GN=secF PE=1 SV=1,ECOLI,29.173167495410326,29.055475840009382,29.06130475069481,28.813318989834954,28.989628465881893,29.151057915272116,29.226719565418993,29.27814762019673
P0AG96,P0AG96,Preprotein translocase subunit SecE,secE,>sp|P0AG96|SECE_ECOLI Preprotein translocase subunit SecE OS=Escherichia coli (strain K12) GN=secE PE=1 SV=1,ECOLI,26.841912975093518,26.026223495669324,26.67106227806998,25.428416918361375,26.0879744427105,26.376897430576825,26.01199854270118,26.323502224296035
P0AG99,P0AG99,Protein-export membrane protein SecG,secG,>sp|P0AG99|SECG_ECOLI Protein-export membrane protein SecG OS=Escherichia coli (strain K12) GN=secG PE=1 SV=1,ECOLI,29.684598140017464,29.657106522970896,29.283216740964793,29.439868598786166,29.68789998534019,29.399216915819824,29.035170309520783,29.096558292464714
P0AGA2,P0AGA2,Protein translocase subunit SecY,secY,>sp|P0AGA2|SECY_ECOLI Protein translocase subunit SecY OS=Escherichia coli (strain K12) GN=secY PE=1 SV=1,ECOLI,30.37472845308828,29.96416722264235,29.446840718297686,30.093897030313745,29.509648392674986,29.40874932885027,29.4840251995541,29.56430130448616
P0AGB0,P0AGB0,Phosphoserine phosphatase,serB,>sp|P0AGB0|SERB_ECOLI Phosphoserine phosphatase OS=Escherichia coli (strain K12) GN=serB PE=1 SV=1,ECOLI,26.635207372186702,26.150094879993762,25.694704134486695,26.404302215589,25.900346859521267,25.476078153937515,25.68641946918878,25.552313970227605
P0AGB6,P0AGB6,RNA polymerase sigma-E factor,rpoE,>sp|P0AGB6|RPOE_ECOLI RNA polymerase sigma-E factor OS=Escherichia coli (strain K12) GN=rpoE PE=1 SV=1,ECOLI,27.519437370384047,27.589191307436444,27.74772098253621,27.69234416764205,27.768865067370328,27.679686281636116,27.90312182245138,28.054552844014335
P0AGC3,P0AGC3,Soluble lytic murein transglycosylase,slt,>sp|P0AGC3|SLT_ECOLI Soluble lytic murein transglycosylase OS=Escherichia coli (strain K12) GN=slt PE=1 SV=1,ECOLI,29.90709478457447,30.062243607504765,29.90624265072001,29.93605510396788,29.942526246761947,29.944752039567803,29.968852216150328,29.983758149000554
P0AGC7,P0AGC7,Protein smp,smp,>sp|P0AGC7|SMP_ECOLI Protein smp OS=Escherichia coli (strain K12) GN=smp PE=3 SV=1,ECOLI,25.674410546311584,25.381421896709632,25.290847409079277,24.754925437380795,24.908102219322945,25.307919323001354,24.90995852709676,24.737688765579215
P0AGD1,P0AGD1,Superoxide dismutase [Cu-Zn],sodC,>sp|P0AGD1|SODC_ECOLI Superoxide dismutase [Cu-Zn] OS=Escherichia coli (strain K12) GN=sodC PE=1 SV=1,ECOLI,32.48879941027727,32.235505539739876,32.63124223901532,31.906859963678286,32.18635078390429,32.40661508190348,32.09577933050842,31.981903122619112
P0AGD3,P0AGD3,Superoxide dismutase [Fe],sodB,>sp|P0AGD3|SODF_ECOLI Superoxide dismutase [Fe] OS=Escherichia coli (strain K12) GN=sodB PE=1 SV=2,ECOLI,33.15545881186462,33.388779904022286,32.92389375429326,33.384990055825284,33.4763559997014,32.97915808027737,33.52019428958237,33.38243063566975
P0AGD7,P0AGD7,Signal recognition particle protein,ffh,>sp|P0AGD7|SRP54_ECOLI Signal recognition particle protein OS=Escherichia coli (strain K12) GN=ffh PE=1 SV=1,ECOLI,30.44778280065834,30.795935028717093,30.812080446031107,30.875229238348393,30.853486466018666,30.800905023582125,30.86576375028723,31.020834920579418
P0AGE0;P18310,P0AGE0,Single-stranded DNA-binding protein,ssb,>sp|P0AGE0|SSB_ECOLI Single-stranded DNA-binding protein OS=Escherichia coli (strain K12) GN=ssb PE=1 SV=2,ECOLI,29.73503063569987,29.82465656059329,29.999552861715042,29.750616922601637,29.95807483045883,29.92312033878844,29.78538053881491,29.817433329557794
P0AGE6,P0AGE6,Uncharacterized protein yieF,yieF,>sp|P0AGE6|YIEF_ECOLI Uncharacterized protein yieF OS=Escherichia coli (strain K12) GN=yieF PE=3 SV=1,ECOLI,29.61686341200438,29.941117758339786,29.789975905111675,30.006725686376377,30.227805211076006,29.718644001407057,30.188508014048036,30.207679908396106
P0AGE9,P0AGE9,Succinyl-CoA ligase [ADP-forming] subunit alpha,sucD,>sp|P0AGE9|SUCD_ECOLI Succinyl-CoA ligase [ADP-forming] subunit alpha OS=Escherichia coli (strain K12) GN=sucD PE=1 SV=2,ECOLI,34.770237170493495,34.526462670524936,34.775151115484306,34.655047806885406,34.6607207481041,34.72377778719407,34.5677950183672,34.57366716159473
P0AGF2,P0AGF2,Uncharacterized SufE-like protein YgdK,ygdK,>sp|P0AGF2|YGDK_ECOLI Uncharacterized sufE-like protein ygdK OS=Escherichia coli (strain K12) GN=ygdK PE=1 SV=1,ECOLI,25.832676369257445,26.120550604379748,26.22362721885338,26.139851990748973,25.633688505195522,25.98591752024081,26.12741739119409,25.85377118991938
P0AGG0,P0AGG0,Thiamine-monophosphate kinase,thiL,>sp|P0AGG0|THIL_ECOLI Thiamine-monophosphate kinase OS=Escherichia coli (strain K12) GN=thiL PE=1 SV=1,ECOLI,27.457139342795585,27.3391893077297,27.457500391492292,27.28693285877963,27.521080005946676,27.535169391264827,27.210142192962824,27.305367623851012
P0AGG2,P0AGG2,Acyl-CoA thioesterase 2,tesB,>sp|P0AGG2|TESB_ECOLI Acyl-CoA thioesterase 2 OS=Escherichia coli (strain K12) GN=tesB PE=1 SV=2,ECOLI,29.456145360810687,29.975835367939464,29.600187782626737,29.773795729958678,29.95993001994555,29.656447012802918,29.970751213281645,29.820373663314673
P0AGG4,P0AGG4,Thioredoxin-2,trxC,>sp|P0AGG4|THIO2_ECOLI Thioredoxin-2 OS=Escherichia coli (strain K12) GN=trxC PE=1 SV=1,ECOLI,27.543871894566706,27.81164648602287,27.574291175742097,26.99594531195236,27.79934453925777,27.44909479807766,26.587770255820438,26.899093941102887
P0AGG8,P0AGG8,Protein tldD,tldD,>sp|P0AGG8|TLDD_ECOLI Protein tldD OS=Escherichia coli (strain K12) GN=tldD PE=1 SV=1,ECOLI,28.910383517305213,29.535524777288046,29.25832504697911,30.04060761516527,29.707076557198658,29.29070422319114,29.77451919674954,29.787349492730122
P0AGI1,P0AGI1,Ribose transport system permease protein rbsC,rbsC,>sp|P0AGI1|RBSC_ECOLI Ribose transport system permease protein rbsC OS=Escherichia coli (strain K12) GN=rbsC PE=1 SV=1,ECOLI,27.092216479224973,27.194414397380598,27.696101092209673,27.648728336781492,27.16109255401172,27.716734778583767,27.243377951864293,27.55216581155832
P0AGI8,P0AGI8,Trk system potassium uptake protein trkA,trkA,>sp|P0AGI8|TRKA_ECOLI Trk system potassium uptake protein trkA OS=Escherichia coli (strain K12) GN=trkA PE=1 SV=1,ECOLI,27.57562785787958,28.285570143629425,28.129572761519672,28.455278802088188,28.47890612831348,28.15593164510591,28.343170943377526,28.565512928269936
P0AGJ2,P0AGJ2,tRNA (guanosine(18)-2-O)-methyltransferase,trmH,>sp|P0AGJ2|TRMH_ECOLI tRNA (guanosine(18)-2-O)-methyltransferase OS=Escherichia coli (strain K12) GN=trmH PE=1 SV=1,ECOLI,26.147414380576613,27.040559725620586,26.433071857779964,27.15964448600316,27.373854691831777,26.511930928086723,26.838805504814076,26.753986478982704
P0AGJ5,P0AGJ5,Uncharacterized tRNA/rRNA methyltransferase YfiF,yfiF,>sp|P0AGJ5|YFIF_ECOLI Uncharacterized tRNA/rRNA methyltransferase YfiF OS=Escherichia coli (strain K12) GN=yfiF PE=3 SV=1,ECOLI,29.781157795509493,30.070396677470175,29.781440571161532,30.108197402566166,30.193282446189954,29.816623114262168,30.201157715767348,30.12803688938627
P0AGJ9,P0AGJ9,Tyrosine--tRNA ligase,tyrS,>sp|P0AGJ9|SYY_ECOLI Tyrosine--tRNA ligase OS=Escherichia coli (strain K12) GN=tyrS PE=1 SV=2,ECOLI,31.14248176685194,31.680705614442576,31.503123527956063,32.022574515034364,31.668072299298498,31.606850934653064,31.984612524091332,31.958721372700424
P0AGK4,P0AGK4,RNA-binding protein YhbY,yhbY,>sp|P0AGK4|YHBY_ECOLI RNA-binding protein YhbY OS=Escherichia coli (strain K12) GN=yhbY PE=1 SV=1,ECOLI,29.412473363293103,29.981146079308235,29.950132910847337,30.033000660053087,30.04305756412469,29.9671627497326,30.258469882496033,30.579846418829426
P0AGK8,P0AGK8,HTH-type transcriptional regulator IscR,iscR,>sp|P0AGK8|ISCR_ECOLI HTH-type transcriptional regulator iscR OS=Escherichia coli (strain K12) GN=iscR PE=1 SV=1,ECOLI,29.33769373541576,29.140198921936758,29.324176043022938,29.715618609621977,29.398561740093914,29.325663940337975,29.177814662136033,28.997561332884004
P0AGL2,P0AGL2,Putative reactive intermediate deaminase TdcF,tdcF,>sp|P0AGL2|TDCF_ECOLI Putative reactive intermediate deaminase TdcF OS=Escherichia coli (strain K12) GN=tdcF PE=1 SV=1,ECOLI,25.131545817848835,25.032978840050834,24.66036728575958,24.641101349156948,25.520569555614077,25.36371021088882,25.05575892822959,24.77589957228828
P0AGL7,P0AGL7,Ribosomal RNA small subunit methyltransferase E,rsmE,>sp|P0AGL7|RSME_ECOLI Ribosomal RNA small subunit methyltransferase E OS=Escherichia coli (strain K12) GN=rsmE PE=1 SV=1,ECOLI,27.90082802617211,27.794792601543058,27.611645039666094,27.596154117831833,27.675794736932822,27.39705832025396,27.56661609501822,27.36360011664603
P0C018,P0C018,50S ribosomal protein L18,rplR,>sp|P0C018|RL18_ECOLI 50S ribosomal protein L18 OS=Escherichia coli (strain K12) GN=rplR PE=1 SV=1,ECOLI,32.536829046016784,31.921624509717276,32.11051020873927,31.60005604653871,31.77050038417239,32.16500181204486,31.210888379915005,31.65053420358127
P0C037,P0C037,UPF0345 protein YaiE,yaiE,>sp|P0C037|YAIE_ECOLI UPF0345 protein yaiE OS=Escherichia coli (strain K12) GN=yaiE PE=3 SV=1,ECOLI,28.951652088063316,29.31056529916528,29.46315224277204,28.776531591899097,28.87514051738555,28.930207404840502,28.61595255011017,28.758327735850386
P0C054,P0C054,Small heat shock protein IbpA,ibpA,>sp|P0C054|IBPA_ECOLI Small heat shock protein ibpA OS=Escherichia coli (strain K12) GN=ibpA PE=1 SV=1,ECOLI,27.891570058311014,28.359421608606,28.281106687398488,28.503566767016117,28.352415854616584,28.200098017995668,28.686914633782596,28.735119824000474
P0C058,P0C058,Small heat shock protein IbpB,ibpB,>sp|P0C058|IBPB_ECOLI Small heat shock protein ibpB OS=Escherichia coli (strain K12) GN=ibpB PE=1 SV=1,ECOLI,25.8526607437116,25.941903504047737,25.39592209710171,24.975990585311884,25.517379018951853,25.53762660512734,24.254912063082845,25.18382689554502
P0C066,P0C066,Membrane-bound lytic murein transglycosylase C,mltC,>sp|P0C066|MLTC_ECOLI Membrane-bound lytic murein transglycosylase C OS=Escherichia coli (strain K12) GN=mltC PE=2 SV=1,ECOLI,NA,24.00361364115386,23.6097109203574,23.591504261776123,24.1847749662817,24.229446557592794,24.066271453083115,23.930802800830225
P0C077,P0C077,mRNA interferase RelE,relE,>sp|P0C077|RELE_ECOLI mRNA interferase RelE OS=Escherichia coli (strain K12) GN=relE PE=1 SV=1,ECOLI,24.61644825110494,24.644298448577935,24.82326005051579,23.52842813313886,23.677946511310765,24.692602360651,24.696002019561966,24.714997641476003
P0C079,P0C079,Antitoxin RelB,relB,>sp|P0C079|RELB_ECOLI Antitoxin RelB OS=Escherichia coli (strain K12) GN=relB PE=1 SV=1,ECOLI,26.294950922339773,26.246912071073844,25.85199817145481,25.731519998516372,26.267212177096194,25.7040602569696,26.3307700314297,26.37153133473792
P0C093,P0C093,Nucleoid occlusion factor SlmA,slmA,>sp|P0C093|SLMA_ECOLI Nucleoid occlusion factor SlmA OS=Escherichia coli (strain K12) GN=slmA PE=1 SV=1,ECOLI,27.414108654455898,27.364735092842974,27.362050188312764,27.48049295017024,27.59772661867716,27.267416072520934,27.30866702883744,27.3744503447469
P0C0K3,P0C0K3,Protein rdoA,rdoA,>sp|P0C0K3|RDOA_ECOLI Protein rdoA OS=Escherichia coli (strain K12) GN=rdoA PE=1 SV=1,ECOLI,26.25902111947049,26.819469721908344,26.30300370646352,26.633961061019015,27.139797406715473,26.121533707437667,27.06124885168896,26.631438874615267
P0C0L2,P0C0L2,Peroxiredoxin osmC,osmC,>sp|P0C0L2|OSMC_ECOLI Peroxiredoxin osmC OS=Escherichia coli (strain K12) GN=osmC PE=1 SV=2,ECOLI,32.92379516154727,33.411343871816015,33.23791684065908,32.97055344700145,33.1899423808314,33.449129198097026,33.00211046490528,33.15174409521747
P0C0L7,P0C0L7,Proline/betaine transporter,proP,>sp|P0C0L7|PROP_ECOLI Proline/betaine transporter OS=Escherichia coli (strain K12) GN=proP PE=1 SV=1,ECOLI,29.21015068758759,29.088043347572512,29.30436129761553,28.671140510170552,28.79493819017934,29.218504934420796,29.33371584977336,28.936637348063407
P0C0R7,P0C0R7,Ribosomal RNA large subunit methyltransferase E,rlmE,>sp|P0C0R7|RLME_ECOLI Ribosomal RNA large subunit methyltransferase E OS=Escherichia coli (strain K12) GN=rlmE PE=1 SV=1,ECOLI,28.313633621018948,28.012333241071673,27.63381776458247,28.307256544778586,28.12053279705965,27.662631117456385,28.07674823478222,27.966684635641613
P0C0S1,P0C0S1,Small-conductance mechanosensitive channel,mscS,>sp|P0C0S1|MSCS_ECOLI Small-conductance mechanosensitive channel OS=Escherichia coli (strain K12) GN=mscS PE=1 SV=1,ECOLI,29.54950768522292,29.679854976356356,29.877885828831662,29.84485340444914,29.96959540218367,29.84955171311988,29.98155493345699,29.966490084358075
P0C0V0,P0C0V0,Periplasmic serine endoprotease DegP,degP,>sp|P0C0V0|DEGP_ECOLI Periplasmic serine endoprotease DegP OS=Escherichia coli (strain K12) GN=degP PE=1 SV=1,ECOLI,34.304840838900574,34.30223693940613,34.487486637870404,34.45800184246703,34.5024769436195,34.514167314078136,34.26669149343998,34.428370629436785
P0C8J6,P0C8J6,"D-tagatose-1,6-bisphosphate aldolase subunit GatY",gatY,">sp|P0C8J6|GATY_ECOLI D-tagatose-1,6-bisphosphate aldolase subunit GatY OS=Escherichia coli (strain K12) GN=gatY PE=1 SV=1",ECOLI,34.44734409150462,34.300351382775744,34.59804883983854,34.14244151955192,34.39311653720519,34.560053576520545,34.51648466589858,34.48246101150178
P0C8J8,P0C8J8,"D-tagatose-1,6-bisphosphate aldolase subunit gatZ",gatZ,">sp|P0C8J8|GATZ_ECOLI D-tagatose-1,6-bisphosphate aldolase subunit gatZ OS=Escherichia coli (strain K12) GN=gatZ PE=1 SV=1",ECOLI,30.50817411475255,30.951621044759047,30.87024324495781,31.288872439302736,31.212144624514057,30.91830048254259,31.045632623003648,31.068293892073235
P0C960,P0C960,Endo-type membrane-bound lytic murein transglycosylase A,emtA,>sp|P0C960|EMTA_ECOLI Endo-type membrane-bound lytic murein transglycosylase A OS=Escherichia coli (strain K12) GN=emtA PE=1 SV=1,ECOLI,26.370688090346476,26.30562752860691,26.667769805417066,26.683725852157796,26.67057551757696,26.812136577659768,27.02536265622344,26.682011750519628
P0CB39,P0CB39,Phosphoethanolamine transferase CptA,cptA,>sp|P0CB39|CPTA_ECOLI Phosphoethanolamine transferase CptA OS=Escherichia coli (strain K12) GN=cptA PE=1 SV=1,ECOLI,28.374709995923702,28.15494084863861,27.708715743779113,27.8043175733619,28.06640101110068,27.800905023582125,27.798927214708016,27.99181011557119
P0CE48;P0CE47,P0CE48;P0CE47,Elongation factor Tu 2;Elongation factor Tu 1,tufB;tufA,>sp|P0CE48|EFTU2_ECOLI Elongation factor Tu 2 OS=Escherichia coli (strain K12) GN=tufB PE=1 SV=1;>sp|P0CE47|EFTU1_ECOLI Elongation factor Tu 1 OS=Escherichia coli (strain K12) GN=tufA PE=1 SV=1,ECOLI,36.64541565835268,36.657008290980514,36.64013153851468,36.50190800040241,36.59333755667855,36.819024691800834,36.72382517664863,36.73616665752816
P0CG19,P0CG19,Inactive ribonuclease PH,rph,>sp|P0CG19|RNPH_ECOLI Inactive ribonuclease PH OS=Escherichia coli (strain K12) GN=rph PE=3 SV=1,ECOLI,29.449729059782015,28.699454978497517,28.67854113773878,27.762990394995,27.774390026409222,28.833768686093357,27.744023612515537,29.320147582893796
P0CK95,P0CK95,Putative lipoprotein AcfD homolog,yghJ,>sp|P0CK95|ACFD_ECOLI Putative lipoprotein AcfD homolog OS=Escherichia coli (strain K12) GN=yghJ PE=4 SV=1,ECOLI,24.308154683787336,24.17536384451775,NA,24.66171397837597,24.624706158852995,24.718144910145853,24.26753811924855,25.55630851373263
P10100,P10100,Rare lipoprotein A,rlpA,>sp|P10100|RLPA_ECOLI Rare lipoprotein A OS=Escherichia coli (strain K12) GN=rlpA PE=1 SV=1,ECOLI,29.46593321786253,29.448726724332495,29.43300204226067,29.38701834494073,29.5461279896353,29.738579970689685,30.01848101674368,29.32594376984108
P10121,P10121,Signal recognition particle receptor FtsY,ftsY,>sp|P10121|FTSY_ECOLI Cell division protein FtsY OS=Escherichia coli (strain K12) GN=ftsY PE=1 SV=1,ECOLI,29.875224269287447,30.613045251181113,30.62272298740728,30.889025956580618,30.925289819425092,30.51589265400895,30.78511847867117,30.826573334567136
P10346,P10346,Glutamine transport ATP-binding protein GlnQ,glnQ,>sp|P10346|GLNQ_ECOLI Glutamine transport ATP-binding protein GlnQ OS=Escherichia coli (strain K12) GN=glnQ PE=1 SV=1,ECOLI,30.070753027614423,30.201065262950678,30.247735363857245,30.105698796051616,30.116290550423525,30.406868119708378,30.01730025412896,30.182056629300288
P10371,P10371,1-(5-phosphoribosyl)-5-[(5-phosphoribosylamino)methylideneamino] imidazole-4-carboxamide isomerase,hisA,>sp|P10371|HIS4_ECOLI 1-(5-phosphoribosyl)-5-[(5-phosphoribosylamino)methylideneamino] imidazole-4-carboxamide isomerase OS=Escherichia coli (strain K12) GN=hisA PE=1 SV=2,ECOLI,27.00294531993035,26.86202800681489,27.134160638843234,26.825183550871866,26.64042434803783,27.151686151017604,26.302614162899687,26.723917040737703
P10384,P10384,Long-chain fatty acid transport protein,fadL,>sp|P10384|FADL_ECOLI Long-chain fatty acid transport protein OS=Escherichia coli (strain K12) GN=fadL PE=1 SV=5,ECOLI,31.701429020580186,32.23055592187811,32.17851427261964,32.60667580413396,32.525967501115574,32.28038926775744,32.3386244747263,32.40224172089026
